481,NCT05807074,4,Recruiting,breast cancer,TRANEXAMIC ACID,Plasminogen inhibitor,INHIBITOR,plasminogen,PLG,Small molecule,"Improvement in bleeding and bruising has been described by using both intravenous and topical off-label applications of Tranexamic Acid (TXA) in many surgical fields. This trial tests how well applying tranexamic acid (TXA) to the surface of the surgical site (topically) works to reduce post-operative bleeding (hematomas) and fluid collections (seromas) in women undergoing surgery to remove both breasts (bilateral mastectomy) immediately followed by surgery to rebuild the breast (reconstruction). The formation of hematomas and seromas, a common post-mastectomy complication, can interfere with breast reconstruction and increase the risk of infection and wound healing and can potentially delay cancer treatments. TXA is a synthetic molecule that pushes the body's clotting cascade toward clot formation to improve blood clotting. Applying TXA topically to the surgical site before closing the incision may prevent hematoma and seroma formation in post-mastectomy breast reconstruction patients.

Participants will be recruited from patients undergoing bilateral mastectomy at University of California, San Francisco.",no,NA
465,NCT05383196,1,Recruiting,inflammatory breast carcinoma,ONVANSERTIB,Serine/threonine-protein kinase PLK1 inhibitor,INHIBITOR,polo like kinase 1,PLK1,Small molecule,"This research is being done to evaluate the safety and effectiveness of Onvansertib in combination with Paclitaxel in triple-negative breast cancer (TNBC) that has spread to other parts of the body.

The names of the study interventions involved in this study are:

* Onvansertib
* Paclitaxel",yes,TNBC
361,NCT03624543,2,"Active, not recruiting",breast cancer,CFI-400945,Serine/threonine-protein kinase PLK4 inhibitor,INHIBITOR,polo like kinase 4,PLK4,Small molecule,The standard or usual treatment for this disease is to undergo chemotherapy to slow the spread of the disease and relieve some symptoms of cancer. Patients will have already had at least one chemotherapy treatment for their disease at this stage.,yes,NA
80,NCT00429572,2,Completed,breast cancer,FLUDARABINE PHOSPHATE,DNA polymerase (alpha/delta/epsilon) inhibitor,INHIBITOR,"DNA polymerase alpha 1, catalytic subunit",POLA1,Small molecule,"Primary Objectives:

1. To assess the feasibility of mini-allogeneic Peripheral Blood Progenitor Cell (PBPC) transplantation in patients with recurrent or metastatic breast cancer.
2. To determine the success rate (complete remission without severe toxicity or death) at 100 days after the transplant and long-term progression free survival (PFS) rate.
3. To examine the graft vs. breast cancer effect of allogeneic PBPC transplantation.",yes,NA
25,NCT00006459,3,Completed,breast cancer,GEMCITABINE HYDROCHLORIDE,DNA polymerase (alpha/delta/epsilon) inhibitor,INHIBITOR,"DNA polymerase alpha 2, accessory subunit",POLA2,Small molecule,"RATIONALE: Drugs used in chemotherapy use different ways to stop tumor cells from dividing so they stop growing or die. Combining more than one drug may kill more tumor cells. It is not yet known if paclitaxel is more effective with or without gemcitabine for advanced breast cancer.

PURPOSE: Randomized phase III trial to study the effectiveness of paclitaxel with or without gemcitabine in treating women who have advanced breast cancer.",yes,NA
191,NCT01645839,3,Completed,breast cancer,CYTARABINE,DNA polymerase (alpha/delta/epsilon) inhibitor,INHIBITOR,"DNA polymerase alpha 2, accessory subunit",POLA2,Small molecule,The purpose of this study is to evaluate the impact of Depocyte® IT combined with the systemic standard treatment in terms of clinical and/or radiological neuromeningeal progression free survival (SSPN),yes,NA
464,NCT05382286,3,Recruiting,breast cancer,GEMCITABINE,DNA polymerase (alpha/delta/epsilon) inhibitor,INHIBITOR,"DNA polymerase delta 3, accessory subunit",POLD3,Small molecule,"The primary objective of this study is to compare the progression-free survival (PFS) between sacituzumab govitecan-hziy (SG) and pembrolizumab versus treatment of physician's choice (TPC) and pembrolizumab in participants with previously untreated, locally advanced inoperable or metastatic triple-negative breast cancer, whose tumors express programmed cell death ligand 1 (PD-L1).",yes,TNBC
116,NCT00933309,1,Completed,breast cancer,ROSIGLITAZONE,Peroxisome proliferator-activated receptor gamma agonist,AGONIST,peroxisome proliferator activated receptor gamma,PPARG,Small molecule,The goal of this clinical research study is to find the highest tolerable dose of Avandamet that can be given in combination with exemestane to patients who are obese and postmenopausal with hormone-receptive-positive breast cancer that has spread to other parts of the body.,yes,HR+
83,NCT00451555,2,Completed,breast cancer,ENZASTAURIN,Protein kinase C beta inhibitor,INHIBITOR,protein kinase C beta,PRKCB,Small molecule,The primary purpose of this study is to help answer the following research question: whether enzastaurin given together with fulvestrant can help participants who have breast cancer and make the tumor smaller or disappear and for how long.,yes,NA
429,NCT04676516,2,Completed,breast cancer,PEMRAMETOSTAT,Protein arginine N-methyltransferase 5 inhibitor,INHIBITOR,protein arginine methyltransferase 5,PRMT5,Small molecule,"This is a Phase II Randomized Window of Opportunity Trial Evaluating Clinical and Biological effects of PRMT5 inhibitor, GSK3326595, in Early Stage Breast Cancer",yes,NA
27,NCT00028639,2,Completed,breast cancer,BORTEZOMIB,26S proteosome inhibitor,INHIBITOR,proteasome 20S subunit beta 5,PSMB5,Small molecule,"RATIONALE: PS-341 may stop the growth of tumor cells by blocking the enzymes necessary for cancer cell growth.

PURPOSE: Phase II trial to study the effectiveness of PS-341 in treating women who have metastatic breast cancer.",yes,NA
448,NCT05041101,1,"Active, not recruiting",breast carcinoma,GRAPIPRANT,Prostanoid EP4 receptor antagonist,ANTAGONIST,prostaglandin E receptor 4,PTGER4,Small molecule,This phase Ib/II trial tests the safety and side effects of grapiprant and eribulin and whether they work to shrink tumors in patients with inflammatory breast cancer that has spread to other places in the body (metastatic). Grapiprant is an anti-inflammatory drug that may prevent tumor growth. Eribulin may block tumor cell growth by stopping tumor cell division. Giving grapiprant and eribulin together may help to control the disease.,yes,NA
165,NCT01380353,0.5,Completed,breast cancer,DICLOFENAC,Cyclooxygenase inhibitor,INHIBITOR,prostaglandin-endoperoxide synthase 1,PTGS1,Small molecule,"The purpose of this study is to look for ways to improve breast cancer treatment by giving breast cancer drugs through the skin of the breast.

The drug used in this study is a diclofenac epolamine patch and is a nonsteroid anti-inflammatory pain reliever. The drug amount that gathers in the breast, after application of a patch to the skin of the breast, will be measured and compared to the amount that is found in the breast when the patch is applied to the skin of the belly.",no,NA
271,NCT02834403,1,Completed,breast cancer,ASPIRIN,Cyclooxygenase inhibitor,INHIBITOR,prostaglandin-endoperoxide synthase 1,PTGS1,Small molecule,"This is a Phase Ib/II study assessing the maximum tolerated dose (MTD), dose-limiting toxicities (DLTs), recommended Phase 2 dose (RP2D), and efficacy of L-NMMA when combined with docetaxel in refractory locally advanced or metastatic triple negative breast cancer patients. The Phase Ib portion of the study is designed to investigate the combination at two dose levels of docetaxel (75 and 100 mg/m2) and 7 dose levels of L-NMMA (5, 7.5, 10, 12.5, 15, 17.5, and 20 mg/kg). The starting dose of L-NMMA will be 7.5 mg/kg. In the Phase II portion of the study, the starting dose will be the RP2D determined in the Phase Ib portion of the study.",yes,TNBC
290,NCT02950259,1,"Active, not recruiting",breast cancer,INDOMETHACIN,Cyclooxygenase inhibitor,INHIBITOR,prostaglandin-endoperoxide synthase 1,PTGS1,Small molecule,The goal of this study is assess the safety and tolerability of the IRX-2 regimen in patients with early stage breast cancer (ESBC) and to estimate the pathologic complete response rate to neoadjuvant anthracycline-based and non-platinum containing chemotherapy in patients with triple-negative breast cancer who have received the IRX-2 Regimen before chemotherapy.,yes,NA
167,NCT01380353,0.5,Completed,breast cancer,DICLOFENAC EPOLAMINE,Cyclooxygenase inhibitor,INHIBITOR,prostaglandin-endoperoxide synthase 2,PTGS2,Small molecule,"The purpose of this study is to look for ways to improve breast cancer treatment by giving breast cancer drugs through the skin of the breast.

The drug used in this study is a diclofenac epolamine patch and is a nonsteroid anti-inflammatory pain reliever. The drug amount that gathers in the breast, after application of a patch to the skin of the breast, will be measured and compared to the amount that is found in the breast when the patch is applied to the skin of the belly.",no,NA
194,NCT01712009,2,Completed,breast cancer,NAPROXEN,Cyclooxygenase inhibitor,INHIBITOR,prostaglandin-endoperoxide synthase 2,PTGS2,Small molecule,"The primary objective of the study is to estimate the difference in bone pain between breast cancer patients receiving chemotherapy and pegfilgrastim and either no prophylactic intervention, prophylactic naproxen, or prophylactic loratadine.",no,NA
248,NCT02429427,3,Completed,breast cancer,CELECOXIB,Cyclooxygenase-2 inhibitor,INHIBITOR,prostaglandin-endoperoxide synthase 2,PTGS2,Small molecule,"It has been found that the chemical changes that take place in a patient's body during the development of inflammation may provide an environment which stimulates cancer cells. One step in the development of inflammation is the production of certain chemical substances which are important in the formation and spread of tumours. These are called prostaglandins. Cyclo-oxygenase II (COX-2) is an enzyme (a substance that speeds up chemical changes in the body) involved in the production of these prostaglandins and although it is not usually present in most tissues it is made at the sites of inflammation. Celecoxib is a selective Non-Steroidal Anti Inflammatory Drug (NSAID) which works by blocking the action of the COX-2 enzyme, leading to a decrease in the production of prostaglandins and a reduction in inflammation.

The purpose of this study is therefore to find out if celecoxib can be used after breast cancer treatment (chemotherapy and/ or radiotherapy) to reduce inflammation and thus reduce the ability of new tumours to grow and survive.

2590 women with primary breast cancer will be recruited in this study from several locations in the United Kingdom and Germany. Eligible patients will be randomly allocated a treatment group, which can be celecoxib or placebo. Both treatments are taken orally (celecoxib 400mg daily, placebo 2 tablets daily) for a total of 2 years. In addition, hormone receptor positive patients will receive endocrine treatment as per local practice. Patients will prematurely discontinue treatment with celecoxib/placebo if disease progression is confirmed or if patients experience unacceptable toxicity.

Patients will be seen every 6 months for the first 3 years and then off treatment follow-up is carried out annually. Participating patients will also be given the option to take part in the pathology sub-study by donating a sample of the tumour tissue collected at the time of the primary surgery.",yes,NA
251,NCT02463383,0.5,Completed,breast cancer,IBUPROFEN,Cyclooxygenase inhibitor,INHIBITOR,prostaglandin-endoperoxide synthase 2,PTGS2,Small molecule,"Postmenopausal women, stratified by a peroxisome proliferator-activated receptor gamma-2 (PPARG) polymorphism, were given the following treatments in a random order with a 5w wash-out period: a 400mg ibuprofen tablet or a placebo tablet; both treatments were followed after 30min by a single acute dose of 0.4g alcohol per kg bw. Serum estrogen levels were measured before and at three timepoints after alcohol intake. It is hypothesized that the acute decrease in estrogen sulphate and other markers of estrogens after alcohol intake is modulated by ibuprofen and by PPARG genotype.",no,NA
412,NCT04542135,2,Recruiting,breast cancer,SULINDAC,Cyclooxygenase inhibitor,INHIBITOR,prostaglandin-endoperoxide synthase 2,PTGS2,Small molecule,The primary objective of this study is to determine if sulindac at a dose of 150 mg twice a day for 12 months reduces breast density in postmenopausal women at elevated risk of breast cancer when compared to a placebo control.,no,NA
2,NCT00001504,1,Completed,breast cancer,ALITRETINOIN,Retinoid receptor agonist,AGONIST,retinoic acid receptor alpha,RARA,Small molecule,"This is a dosage escalation study to estimate the maximum tolerated dose of 9-cis-retinoic acid given in combination with tamoxifen. Groups of 3 to 6 patients receive oral 9-cis-retinoic acid daily for 4 weeks, after which daily oral tamoxifen is added to the regimen. Patients continue treatment for up to 28 weeks, with tamoxifen continued after the study if medically appropriate.",yes,NA
145,NCT01234337,3,Completed,breast cancer,SORAFENIB,Tyrosine-protein kinase receptor RET inhibitor,INHIBITOR,ret proto-oncogene,RET,Small molecule,"The objective of this phase-III trial is to compare the efficacy and safety of sorafenib in combination with capecitabine versus capecitabine in combination with placebo in the treatment of subjects with locally advanced or metastatic HER2-negative breast cancer who are resistant to or have failed prior taxane and an anthracycline or for whom further anthracycline therapy is not indicated. After signing consent there can be up to 28 days before starting the treatment during which time a number of tests will be carried out which will include tumor evaluations and medical history. The following tests and evaluations will have to be done within 7 days of the start of treatment,on Day 1 of every cycle and at the end of study: Electrocardiogram, blood tests, patient quality of life questionnaires and a complete physical exam and vital signs. Treatment will be given in 21 day cycles with sorafenib/placebo to be taken every day for 21 days and capecitabine to be taken for the first 14 days. Patients will come in weekly for the first 6 weeks and then on Day1 for every cycle after the first 2 cycles. During the weekly visits the subjects will be check for any side effects and blood draws will happen for the study on Day 1 of each cycle. Subjects will be followed for overall survival.",yes,Her2-
11,NCT00003752,2,Completed,breast cancer,BEXAROTENE,Retinoid X receptor agonist,AGONIST,retinoid X receptor beta,RXRB,Small molecule,"RATIONALE: Drugs used in chemotherapy use different ways to stop tumor cells from dividing so they stop growing or die.

PURPOSE: Randomized phase II trial to study the effectiveness of bexarotene in treating patients who have metastatic breast cancer.",yes,NA
374,NCT03941743,1,Completed,breast carcinoma,FINGOLIMOD HYDROCHLORIDE,Sphingosine 1-phosphate receptor agonist,AGONIST,sphingosine-1-phosphate receptor 4,S1PR4,Small molecule,This trial phase I studies how well fingolimod works in preventing chemotherapy-induced nerve pain (neuropathy) in patients with breast cancer who are taking paclitaxel. Fingolimod acts by suppressing immune reactions in the brain. This study is being done to see if fingolimod can reduce neuropathy caused by paclitaxel.,no,NA
376,NCT03941743,1,Completed,breast carcinoma,FINGOLIMOD,Sphingosine 1-phosphate receptor binding agent,BINDING AGENT,sphingosine-1-phosphate receptor 5,S1PR5,Small molecule,This trial phase I studies how well fingolimod works in preventing chemotherapy-induced nerve pain (neuropathy) in patients with breast cancer who are taking paclitaxel. Fingolimod acts by suppressing immune reactions in the brain. This study is being done to see if fingolimod can reduce neuropathy caused by paclitaxel.,no,NA
341,NCT03360214,4,Completed,breast cancer,ROPIVACAINE HYDROCHLORIDE,Sodium channel alpha subunit blocker,BLOCKER,sodium voltage-gated channel alpha subunit 11,SCN11A,Small molecule,"This is a prospective randomized controlled double-blind interventional study comparing the effect of pulsed-electromagnetic field device (PEMF), pectoral interfascial block (PIB), and placebo on postoperative pain control. This study has the interdisciplinary cooperation of the regional anesthesia group, and the breast and plastic surgery divisions. All female patients with breast cancer evaluated at Columbia University Medical Center (CUMC) who are undergoing unilateral or bilateral mastectomy with tissue expander reconstruction will be offered enrollment in this prospective study.",no,NA
449,NCT05072314,4,Recruiting,breast cancer,LIDOCAINE,Sodium channel alpha subunit blocker,BLOCKER,sodium voltage-gated channel alpha subunit 2,SCN2A,Small molecule,"The LOLIPOP Trial is a large (n=4,300 patients) pragmatic, international, multicentre, prospective, randomised, double blind, placebo-controlled, parallel assessment, safety and effectiveness superiority study.",no,NA
344,NCT03360214,4,Completed,breast cancer,BUPIVACAINE HYDROCHLORIDE,Sodium channel protein type IV alpha subunit blocker,BLOCKER,sodium voltage-gated channel alpha subunit 4,SCN4A,Small molecule,"This is a prospective randomized controlled double-blind interventional study comparing the effect of pulsed-electromagnetic field device (PEMF), pectoral interfascial block (PIB), and placebo on postoperative pain control. This study has the interdisciplinary cooperation of the regional anesthesia group, and the breast and plastic surgery divisions. All female patients with breast cancer evaluated at Columbia University Medical Center (CUMC) who are undergoing unilateral or bilateral mastectomy with tissue expander reconstruction will be offered enrollment in this prospective study.",no,NA
347,NCT03360214,4,Completed,breast cancer,BUPIVACAINE,Sodium channel protein type IV alpha subunit blocker,BLOCKER,sodium voltage-gated channel alpha subunit 4,SCN4A,Small molecule,"This is a prospective randomized controlled double-blind interventional study comparing the effect of pulsed-electromagnetic field device (PEMF), pectoral interfascial block (PIB), and placebo on postoperative pain control. This study has the interdisciplinary cooperation of the regional anesthesia group, and the breast and plastic surgery divisions. All female patients with breast cancer evaluated at Columbia University Medical Center (CUMC) who are undergoing unilateral or bilateral mastectomy with tissue expander reconstruction will be offered enrollment in this prospective study.",no,NA
394,NCT04248179,4,Completed,breast ductal carcinoma in situ,ROPIVACAINE,Sodium channel alpha subunit blocker,BLOCKER,sodium voltage-gated channel alpha subunit 4,SCN4A,Small molecule,"The investigators have developed a novel ultrasound-guided nerve block indicated primarily for breast cancer surgery that mimic a thoracic paravertebral block (TPVB) - hitherto the internationally accepted regional anesthesia golden standard for anesthesia of the hemithorax - but hypothetically without the risks of adverse events associated with the TPVB (i.e. pneumothorax, risk of bleeding in the thoracic paravertebral space, random and unmanageable epidural spread etc.). The investigators have already tested the anatomical- and block execution hypothesis in a randomized cadaveric study, and the investigators now have anatomical proof of concept for the functionality of the block technique. The investigators have also conducted a small clinical pilot study with very promising results. The investigators wish to conduct a randomized, placebo controlled and double-blind study, comparing the effect of the ultrasound-guided multiple-injection costotransverse block (MICB) vs. placebo. The aim with this study is to investigate the efficacy of the MICB vs. placebo in patients undergoing unilateral mastectomy and primary reconstructive surgery due to breast cancer or ductal carcinoma in situ. The hypothesis is, that the unilateral MICB will significantly reduce the opioid consumption during the first 24 postoperative hours and significantly reduce the Numerical Rating Scale pain score (0-10) and opioid related side effects.",no,NA
446,NCT05025735,2,Recruiting,breast cancer,DAPAGLIFLOZIN,Sodium/glucose cotransporter 2 inhibitor,INHIBITOR,solute carrier family 5 member 2,SLC5A2,Small molecule,"This will be a single arm, open label pilot to test the combination of dapagliflozin, a commercially available SGLT-2 inhibitor, in combination with alpelisib + fulvestrant in patients with HR+/HER2- mBC. The objective of this study is to determine if the addition of dapagliflozin to the combination of alpelisib and fulvestrant leads to significant reduction in all-grade hyperglycemia.",yes,HR+/Her2-
451,NCT05090358,2,Recruiting,breast cancer,CANAGLIFLOZIN,Sodium/glucose cotransporter 2 inhibitor,INHIBITOR,solute carrier family 5 member 2,SLC5A2,Small molecule,"The purpose of this study to find out whether a very low carbohydrate diet (ketogenic diet), a low carbohydrate diet, or the study drug canagliflozin can prevent high blood sugar and may improve the effectiveness of cancer therapy in people who are receiving standard treatment with alpelisib and fulvestrant for their metastatic PIK3CA-mutant breast cancer.",no,NA
57,NCT00198250,2,Completed,breast cancer,VENLAFAXINE,Norepinephrine transporter inhibitor,INHIBITOR,solute carrier family 6 member 2,SLC6A2,Small molecule,"The purpose of this study is to evaluate Venlafaxine as a treatment option for hot flashes in breast cancer survivors. The goals of this study are to assess the effectiveness and toxicity of venlafaxine hydrochloride and identify the psychological, behavioral, and physical outcomes associated with relief of hot flashes in women following treatment for breast cancer.",no,NA
59,NCT00198250,2,Completed,breast cancer,VENLAFAXINE HYDROCHLORIDE,Norepinephrine transporter inhibitor,INHIBITOR,solute carrier family 6 member 2,SLC6A2,Small molecule,"The purpose of this study is to evaluate Venlafaxine as a treatment option for hot flashes in breast cancer survivors. The goals of this study are to assess the effectiveness and toxicity of venlafaxine hydrochloride and identify the psychological, behavioral, and physical outcomes associated with relief of hot flashes in women following treatment for breast cancer.",no,NA
379,NCT03996265,3,Recruiting,breast cancer,BUPROPION,Dopamine transporter inhibitor,INHIBITOR,solute carrier family 6 member 3,SLC6A3,Small molecule,"This phase III trial studies how well bupropion works in reducing cancer related fatigue in cancer survivors. Bupropion is a drug that is used to treat depression, as well as to help people quit smoking. Cancer and its treatment can cause fatigue. Giving bupropion may improve cancer related fatigue in cancer survivors.",no,NA
381,NCT03996265,3,Recruiting,breast cancer,BUPROPION HYDROCHLORIDE,Dopamine transporter inhibitor,INHIBITOR,solute carrier family 6 member 3,SLC6A3,Small molecule,"This phase III trial studies how well bupropion works in reducing cancer related fatigue in cancer survivors. Bupropion is a drug that is used to treat depression, as well as to help people quit smoking. Cancer and its treatment can cause fatigue. Giving bupropion may improve cancer related fatigue in cancer survivors.",no,NA
322,NCT03122444,0.5,Completed,breast cancer,IMIPRAMINE,Serotonin transporter inhibitor,INHIBITOR,solute carrier family 6 member 4,SLC6A4,Small molecule,Comparing changes in biomarkers from a diagnostic core needle biopsy to surgical pathology specimen or repeat core needle biopsy.,no,NA
217,NCT02027376,1,Completed,breast cancer,SONIDEGIB,Smoothened homolog inhibitor,INHIBITOR,"smoothened, frizzled class receptor",SMO,Small molecule,"This is a single-arm, open-label, phase Ib study. In this trial, patients with Triple Negative (TN) Advanced Breast Cancer (ABC) will be treated with increasing doses of LDE225 (sonidegib) and docetaxel to determine the Maximum Tolerated Dose (MTD), Dose Limiting Toxicity (DLT) and Recommended Phase II Dose (RP2D) of the combination.

Eligible patients with hormonal receptors negative and Human Epidermal Growth Factor Receptor 2 (HER2) negative ABC will be included and treated with docetaxel intravenously in every three weeks cycles. LDE225 will be administered orally at three dose levels 400, 600 and 800mg one a day (QD) (a -1 dose level is included just in case dose de-escalation is needed). Treatment will be repeated on day 1 of a 21-day cycle until radiographic or symptomatic progression, unacceptable toxicity or withdraws informed consent.

The investigators propose to develop a phase Ib trial with the combination of docetaxel with LDE225 in TN ABC patients to define the safety, tolerability and RP2D, as well as to have some information about the efficacy of the combination.",yes,TNBC
99,NCT00559507,2,Completed,male breast carcinoma,SARACATINIB,Tyrosine-protein kinase SRC inhibitor,INHIBITOR,"SRC proto-oncogene, non-receptor tyrosine kinase",SRC,Small molecule,This phase II trial is studying saracatinib to see how well it works in treating patients with metastatic or locally advanced breast cancer that cannot be removed by surgery. Saracatinib may stop the growth of tumor cells by blocking some of the enzymes needed for cell growth,yes,NA
