,NCT_ID,Phase,Status,Disease Name,Drug Name,Mechanism of Action,Action Type,Target Approved Name,Target Approved Symbol,Drug Type,Breif Summary,Impact On Cacner Progression,Cancer Type
3,NCT00001944,1,Completed,breast cancer,TARIQUIDAR,P-glycoprotein 1 inhibitor,INHIBITOR,ATP binding cassette subfamily B member 1,ABCB1,Small molecule,"Tumor resistance to anti-cancer drugs is a major problem in cancer treatment. Studies have found that a protein (P-glycoprotein) on some cancer cells pumps chemotherapy drugs out of the cells, reducing treatment effectiveness. In laboratory tests, an experimental drug called XR9576, has blocked pumping by this protein. It is being used in this study to try to increase the amount of the anti-cancer drug vinorelbine, in cancer cells. Vinorelbine has been shown in several clinical trials to be effective against some advanced cancers, including breast, lung and ovarian, and is one of the drugs pumped out of tumor cells by P-glycoprotein.

Patients with cancer 18 years and older may be eligible for this study. Candidates will be screened with tests that may include blood and urine tests, electrocardiogram, echocardiogram, CT scans, X-rays, and nuclear medicine studies. A tumor biopsy may be done for diagnostic or research purposes.

Study participants will undergo tumor imaging with the radioactive drug Tc-99m Sestamibi. This drug accumulates in tumor cells and is eliminated from them in much the same way that some cancer drugs are eliminated from cells. The drug is injected into a vein and a series of pictures are taken with a gamma camera. After this baseline scan, patients will receive a dose of XR9576 and undergo a second scan 24 hours later. The scan will show whether XR9576 affects the accumulation and elimination of Sestamibi in tumor cells. This procedure may provide a way to monitor cancers for evidence of chemotherapy resistance and show if XR9576 can improve the effectiveness of therapy.

At least 10 days after the baseline and XR9576 scans, patients will begin the first of 3 or more 21-day cycles of vinorelbine treatment. On days 1 and 8 of each cycle, patients will receive a 30-minute infusion of XR9576 intravenously (through a vein) followed by vinorelbine, infused over a 6- to 10-minute period. (In some patients, XR9576 will be administered before only one of the two vinorelbine dosages.)

Physical examination, blood tests, and other procedures may be done periodically to monitor treatment.",yes,NA
253,NCT02594371,3,Completed,breast cancer,ENCEQUIDAR,P-glycoprotein 1 inhibitor,INHIBITOR,ATP binding cassette subfamily B member 1,ABCB1,Small molecule,To determine the safety and tolerability of Oraxol as compared to IV paclitaxel in metastatic breast cancer,no,NA
71,NCT00338728,2,Completed,breast cancer,IMATINIB MESYLATE,Tyrosine-protein kinase ABL inhibitor,INHIBITOR,"ABL proto-oncogene 1, non-receptor tyrosine kinase",ABL1,Small molecule,"This phase II trial studies the side effects and how well letrozole and imatinib mesylate work in treating postmenopausal participants with estrogen or progesterone positive breast cancer that has spread to other places in the body. Letrozole is an antihormonal drug used in the standard treatment of hormonal sensitive breast cancer. Imatinib mesylate is a drug that binds to certain proteins on the tumor cells and prevents them from further growth. Imatinib mesylate is thought to prevent the potential resistance to letrozole, which may make the letrozole more effective. Giving letrozole and imatinib mesylate may work better in treating participants with breast cancer.",yes,ER+/PR+
372,NCT03854903,1,"Active, not recruiting",breast carcinoma,BOSUTINIB,Tyrosine-protein kinase ABL inhibitor,INHIBITOR,"ABL proto-oncogene 1, non-receptor tyrosine kinase",ABL1,Small molecule,"This is an open-label, single-arm, phase I trial. It is designed with a conservative dose escalation plan to ensure patient's safety and with a strong translational component to inform if target inhibition is achieved. With concerns regarding safety, based on extensive available pharmacokinetic data and clinical efficacy experience, bosutinib will be given 5-days in a row followed by 2 days rest in a weekly basis, instead of daily.

The protocol will enroll patients per 3+3 escalation design. The Dose Limiting Toxicity (DLT) observation period is 28 days. At the end of DLT observation period of each cohort of 3 patients, decision will be made regarding further escalation or de-escalation according to this plan. Once the MTD of the combination is reached, the safety data will be analyzed. There will be no dose reductions during DLT observation period. Dose reduction within patients (individually) is allowed after the 4-week DLT observation period. Treatment in this phase I trial will be administered until there is disease progression or unacceptable toxicity.",yes,NA
390,NCT04205903,1,Recruiting,breast cancer,NILOTINIB HYDROCHLORIDE MONOHYDRATE,Tyrosine-protein kinase ABL inhibitor,INHIBITOR,"ABL proto-oncogene 1, non-receptor tyrosine kinase",ABL1,Small molecule,"This phase Ib/II trial studies the side effects and best dose of nilotinib in preventing paclitaxel-induced peripheral neuropathy in stage I-III breast cancer patients who are receiving paclitaxel therapy. Chemotherapy is the usual or ?standard? treatment for breast cancer. It kills cancer cells and lowers the chance that the cancer will come back. Sometimes, this treatment can cause numbness and tingling, especially in the hands and feet. This is called chemotherapy-induced peripheral neuropathy. This study aims to test the safety and effectiveness, both good and bad, of taking nilotinib in preventing chemotherapy-induced peripheral neuropathy.",yes,NA
119,NCT01009918,2,Completed,breast cancer,LISINOPRIL,Angiotensin-converting enzyme inhibitor,INHIBITOR,angiotensin I converting enzyme,ACE,Small molecule,"RATIONALE: Lisinopril or Coreg CR®, may help reduce side effects caused by trastuzumab. It is not yet known whether lisinopril or Coreg CR® are more effective than a placebo in reducing side effects caused by trastuzumab.

PURPOSE: This phase II trial is studying lisinopril and Coreg CR® to see how well they work compared with a placebo in reducing side effects in patients with HER2-positive breast cancer receiving trastuzumab.",no,NA
416,NCT04588935,2,Completed,breast cancer,PERINDOPRIL,Angiotensin-converting enzyme inhibitor,INHIBITOR,angiotensin I converting enzyme,ACE,Small molecule,To develop a method of medical prevention of cardiovascular diseases caused by cardiotoxicity against the background of complex treatment of patients with primary resectable breast cancer to reduce the risk of cardiovascular complications,no,NA
280,NCT02839668,2,Completed,breast cancer,NEOSTIGMINE,Acetylcholinesterase inhibitor,INHIBITOR,acetylcholinesterase (Yt blood group),ACHE,Small molecule,"Because neoplastic disease is one of the leading causes of death worldwide and breast cancer is one of the most frequent neoplasia among women, the possibility of influencing the evolution of patients starting from the moment of surgical intervention using a perianesthesic intervention is a scientific topic of high interest. The study will compare two anesthetic techniques and their efficiency in lowering the factors that can favorize the dissemination of neoplasia and their role in the prevention of postoperative pain. The serum level of vascular endothelial growth factor A (VEGF-A) will be determined before and after the surgical intervention after using two different types of anesthesia (inhalational and intravenous), and the immunohistochemical expression of vascular endothelial growth factor receptors (VEGFR) will be determined on the excised tissue. For the two different types of anesthesia a continuous infusion of lidocaine 1% will be associated. The study will compare the short-term and long term-outcome of the patients assigned the two different types of anesthesia and their immediate postoperative evolution .",no,NA
365,NCT03768492,2,Recruiting,breast carcinoma,CAFFEINE,Adenosine receptor antagonist,ANTAGONIST,adenosine A3 receptor,ADORA3,Small molecule,The purpose of the study is to evaluate whether a caffeine-based cream can reduce the rates of reconstructive complications in patients with tissue expander based reconstruction requiring post-mastectomy radiation therapy when compared to a placebo cream.,no,NA
121,NCT01009918,2,Completed,breast cancer,CARVEDILOL PHOSPHATE,Adrenergic receptor alpha-1 antagonist,ANTAGONIST,adrenoceptor alpha 1B,ADRA1B,Small molecule,"RATIONALE: Lisinopril or Coreg CR®, may help reduce side effects caused by trastuzumab. It is not yet known whether lisinopril or Coreg CR® are more effective than a placebo in reducing side effects caused by trastuzumab.

PURPOSE: This phase II trial is studying lisinopril and Coreg CR® to see how well they work compared with a placebo in reducing side effects in patients with HER2-positive breast cancer receiving trastuzumab.",no,NA
223,NCT02177175,2,Completed,breast cancer,CARVEDILOL,Adrenergic receptor alpha-1 antagonist,ANTAGONIST,adrenoceptor alpha 1D,ADRA1D,Small molecule,"The purpose of this study is to find out the effects, good and/or bad, of a beta blocker (carvedilol) on heart function during treatment with anti-HER2 medication(s) including trastuzumab (Herceptin).",no,NA
424,NCT04603911,2,Recruiting,breast cancer,CLONIDINE,Adrenergic receptor alpha-2 agonist,AGONIST,adrenoceptor alpha 2A,ADRA2A,Small molecule,"The object of our research is to investigate the relative efficacy of liposomal bupivacaine administered via an Erector Spinae Plane (ESP) block as compared to our standard of care medication solution of (bupivacaine mixed with epinephrine, dexamethasone, and clonidine) for pain management in subjects undergoing bilateral surgical intervention for breast cancer. This will be an investigator-initiated, double-blind, patient-controlled, randomized control trial comparing pain scores at 48 hours after injection.",no,NA
477,NCT05732064,4,Recruiting,breast cancer,DEXMEDETOMIDINE,Adrenergic receptor alpha-2 agonist,AGONIST,adrenoceptor alpha 2A,ADRA2A,Small molecule,"Breast cancer patients often have sleep disturbances during the perioperative period. Dexmedetomidine is a highly selective alpha 2-adrenoceptor agonist with sedative, anxiolytic, and analgesic effects. Previous studies showed that night-time low-dose dexmedetomidine infusion improved sleep quality. Esketamine is a N-methyl-D-aspartic acid receptor antagonist and has been used as an anesthetic and analgesic. Recent studies showed that low-dose esketamine has anti-depressive and sleep-promoting effects. The investigators suppose that low-dose dexmedetomidine-esketamine combined nasal administration at night can improve perioperative sleep quality in patients scheduled for breast cancer surgery.",no,NA
418,NCT04588935,2,Completed,breast cancer,BISOPROLOL,Beta-1 adrenergic receptor antagonist,ANTAGONIST,adrenoceptor beta 1,ADRB1,Small molecule,To develop a method of medical prevention of cardiovascular diseases caused by cardiotoxicity against the background of complex treatment of patients with primary resectable breast cancer to reduce the risk of cardiovascular complications,no,NA
204,NCT01847001,2,Completed,breast cancer,PROPRANOLOL,Beta-2 adrenergic receptor antagonist,ANTAGONIST,adrenoceptor beta 2,ADRB2,Small molecule,"This study is being conducted in patients with newly diagnosed breast cancer that will be undergoing chemotherapy prior to surgery - neoadjuvant chemotherapy. The study involves treatment with standard chemotherapy and a commonly used, FDA-approved, blood pressure drug called propranolol (Inderal). The purposes of this study are to:

1. Determine the effect of propranolol plus chemotherapy on breast cancer cells as well as the growth of blood vessels surrounding breast cancer cells.
2. Determine the side effect profile of propranolol and chemotherapy in patients with breast cancer receiving neoadjuvant chemotherapy.

This research is being done because previous laboratory work has shown that propranolol may decrease the ability for the blood vessels around breast cancer cells to grow, which may be important in helping cancer cells grow. It also may reduce the likelihood for breast cancer cells to spread. If changes are seen in the breast cancer cells and surrounding blood vessels in this study, we will pan to evaluate whether propranolol decreases the likelihood of breast cancer from recurring in future, later studies. All chemotherapy regimens used in this study have been the standard of care for many years; however, the use of propranolol is being researched along with the chemotherapy regimens.",yes,NA
426,NCT04603911,2,Recruiting,breast cancer,EPINEPHRINE,Adrenergic receptor agonist,AGONIST,adrenoceptor beta 3,ADRB3,Small molecule,"The object of our research is to investigate the relative efficacy of liposomal bupivacaine administered via an Erector Spinae Plane (ESP) block as compared to our standard of care medication solution of (bupivacaine mixed with epinephrine, dexamethasone, and clonidine) for pain management in subjects undergoing bilateral surgical intervention for breast cancer. This will be an investigator-initiated, double-blind, patient-controlled, randomized control trial comparing pain scores at 48 hours after injection.",no,NA
84,NCT00459771,3,Completed,breast cancer,CANDESARTAN CILEXETIL,Type-1 angiotensin II receptor antagonist,ANTAGONIST,angiotensin II receptor type 1,AGTR1,Small molecule,Evaluating the effect of the angiotensin II-receptor (AT1) blocker candesartan vs placebo in prevention of trastuzumab-associated cardiotoxicity in patients with primary breast cancer treated with trastuzumab.,no,NA
152,NCT01277757,2,Completed,breast carcinoma,MK-2206,Serine/threonine-protein kinase AKT inhibitor,INHIBITOR,AKT serine/threonine kinase 1,AKT1,Small molecule,This phase II trial studies how well Akt inhibitor MK2206 works in treating patients with breast cancer cancer that has spread to other places in the body and usually cannot be cured or controlled with treatment. Akt inhibitor MK2206 may stop the growth of tumor cells by blocking some of the enzymes needed for cell growth.,yes,NA
329,NCT03337724,3,Completed,breast cancer,IPATASERTIB,Serine/threonine-protein kinase AKT inhibitor,INHIBITOR,AKT serine/threonine kinase 1,AKT1,Small molecule,"This study will evaluate the efficacy of ipatasertib + paclitaxel versus placebo + paclitaxel in participants with histologically confirmed, locally advanced or metastatic triple-negative breast cancer (TNBC) and in participants with locally advanced or metastatic hormone receptor positive (HR+)/ human epidermal growth factor receptor 2 negative (HER2-) breast adenocarcinoma who are not suitable for endocrine therapy.",yes,TNBC/HR+/Her2-
209,NCT01964924,2,Completed,triple-negative breast cancer,UPROSERTIB,Serine/threonine-protein kinase AKT inhibitor,INHIBITOR,AKT serine/threonine kinase 2,AKT2,Small molecule,"This phase II trial studies how well trametinib and v-akt murine thymoma viral oncogene homolog 1 (Akt) inhibitor GSK2141795 work in treating patients with triple-negative breast cancer (breast cancer cells that do not have estrogen receptors, progesterone receptors, or large amounts of human epidermal growth factor receptor 2 \[HER2/neu\] protein) that has spread to other places in the body. Trametinib and Akt inhibitor GSK2141795 may stop the growth of tumor cells by blocking some of the enzymes needed for cell growth.",yes,TNBC
404,NCT04305496,3,"Active, not recruiting",breast cancer,CAPIVASERTIB,Serine/threonine-protein kinase AKT inhibitor,INHIBITOR,AKT serine/threonine kinase 2,AKT2,Small molecule,"Phase III, double-blind, randomised study assessing the efficacy of capivasertib + fulvestrant vs placebo + fulvestrant for the treatment of patients with locally advanced (inoperable) or metastatic HR+/HER2- breast cancer following recurrence or progression on or after AI therapy.",yes,HR+/Her2-
437,NCT04851613,1,"Active, not recruiting",breast cancer,AFURESERTIB,Serine/threonine-protein kinase AKT inhibitor,INHIBITOR,AKT serine/threonine kinase 2,AKT2,Small molecule,"Study LAE205INT3101 is a Phase Ib/III study to evaluate the efficacy and safety of the combination therapy with afuresertib plus fulvestrant (afuresertib/placebo plus fulvestrant in Phase III) in patients with HR+/HER2- breast cancer who have failed 1 to 2 prior lines of endocrine therapy, and/or CDK4/6 inhibitor (up to 1 therapy), and/or chemotherapy (up to 1 chemotherapy) as described in the inclusion criteria.",yes,HR+/Her2-
399,NCT04265274,2,Recruiting,breast cancer,DISULFIRAM,Aldehyde dehydrogenase inhibitor,INHIBITOR,aldehyde dehydrogenase 2 family member,ALDH2,Small molecule,"This is a proof-of-concept study to define efficacy of vinorelbine, cisplatin, disulfiram and copper in CTC_EMT positive refractory metastatic hormone receptor positive, HER2 negative breast cancer.",yes,HR+/Her2-
289,NCT02910219,2,Completed,breast cancer,CROFELEMER,Anoctamin-1 blocker,BLOCKER,anoctamin 1,ANO1,Small molecule,Chemotherapy induced diarrhea is seen in up to 40-80% of patients receiving this treatment for HER2 positive locally advanced or metastatic breast cancer. This diarrhea can significantly impact a patient's quality of life and ability to tolerate chemo/anti-HER2 therapy. This study will look at the efficacy of the drug crofelemer in preventing diarrhea in breast cancer patients.,no,NA
38,NCT00080756,2,"Active, not recruiting",Hereditary breast and ovarian cancer syndrome,TESTOSTERONE,Androgen Receptor agonist,AGONIST,androgen receptor,AR,Small molecule,"RATIONALE: Chemoprevention therapy is the use of certain drugs to try to prevent the development or recurrence of cancer. Deslorelin combined with low-dose add-back estradiol and testosterone (given to replace hormones suppressed by deslorelin) may be effective in preventing breast cancer in at-risk women.

PURPOSE: This phase II trial is studying how well giving deslorelin together with estradiol and testosterone works in preventing breast cancer in premenopausal women who are at high risk for this disease.",yes,NA
252,NCT02580448,1,Completed,male breast carcinoma,SEVITERONEL,Androgen Receptor antagonist,ANTAGONIST,androgen receptor,AR,Small molecule,"The goal of this clinical study is to determine the safety, pharmacokinetics, pharmacodynamics and efficacy and activity of seviteronel, a lyase-selective inhibitor of CYP17, in patients with advanced breast cancer.",yes,NA
263,NCT02689427,2,Recruiting,triple-negative breast cancer,ENZALUTAMIDE,Androgen Receptor antagonist,ANTAGONIST,androgen receptor,AR,Small molecule,"This phase IIB trial studies how well enzalutamide and paclitaxel before surgery works in treating patients with stage I-III androgen receptor-positive triple-negative breast cancer. Androgens can cause the growth of triple-negative breast cancer. Anti-hormone therapy, such as enzalutamide, prevent androgen from binding to the androgen receptor, thereby decreasing cell growth and causing tumor cell death. Drugs used in chemotherapy, such as paclitaxel, work in different ways to stop the growth of tumor cells, either by killing the cells, by stopping them from dividing, or by stopping them from spreading. Giving enzalutamide and paclitaxel before surgery may make the tumor smaller and reduce the amount of normal tissue that needs to be removed. This treatment study is part of the MD Anderson Moonshot initiative.",yes,AR+/TNBC
351,NCT03383679,2,Completed,breast cancer,DAROLUTAMIDE,Androgen Receptor antagonist,ANTAGONIST,androgen receptor,AR,Small molecule,"This is a multicenter uncontrolled, open-label, prospective, non-comparative randomized, phase II study. Patients will be randomized between darolutamide in Arm n°1 (two-stage Simon's design) and capecitabine in Arm n°2 with two patients randomized in Arm n°1 for one patient randomized in Arm n°2.

The trial population is composed of women over 18 years old with triple-negative and androgen receptor positive, locally recurrent (unresectable) or metastatic breast cancer.",yes,AR+/TNBC
362,NCT03650894,2,"Active, not recruiting",breast carcinoma,BICALUTAMIDE,Androgen Receptor antagonist,ANTAGONIST,androgen receptor,AR,Small molecule,"The goal of this protocol is to evaluate the safety and efficacy of an alternative systemic combination approach that omits or delays the use of chemotherapy in metastatic disease, while improving efficacy and durability of response. The approach combines two potentially effective and previously studied strategies: androgen receptor blockade and immune checkpoint therapy.",yes,AR+
388,NCT04103853,1,Completed,breast cancer,GT-0918,Androgen Receptor antagonist,ANTAGONIST,androgen receptor,AR,Small molecule,"This study is a multi-center, open-label, dose-esclation I/Ib clinical study to explore safety, efficacy an pharmacokinetics of proxalutamide in patients with metastatic breast cancer.

This study includes two stages, stage I: single- and multiple-dose tolerance and pharmacokinetic study; stage 2: preliminary efficacy and safety study.",yes,NA
406,NCT04355858,2,Recruiting,breast cancer,SHR3680,Androgen Receptor antagonist,ANTAGONIST,androgen receptor,AR,Small molecule,"This study is a prospective, single-center, open-label, umbrella-shaped phase II clinical study for patients with HR+/HER2- endocrine-resistant advanced breast cancer.",yes,HR+/Her2-
442,NCT04869943,3,"Active, not recruiting",breast cancer,ENOBOSARM,Androgen Receptor modulator,MODULATOR,androgen receptor,AR,Small molecule,To demonstrate the efficacy of enobosarmin the treatment of androgen receptor positive (AR+) and estrogen receptor positive (ER+) metastatic breast cancer (MBC) as measured by radiographic progression free survival (rPFS).,yes,AR+/ER+
201,NCT01763931,2,Completed,breast cancer,DIGOXIN,Sodium/potassium-transporting ATPase inhibitor,INHIBITOR,ATPase Na+/K+ transporting subunit alpha 4,ATP1A4,Small molecule,The purpose of this study is to learn what effects digoxin (DIG) may have on human breast cancer tissue.,yes,NA
254,NCT02595372,2,Completed,breast carcinoma,OMEPRAZOLE,Potassium-transporting ATPase inhibitor,INHIBITOR,ATPase H+/K+ transporting subunit alpha,ATP4A,Small molecule,"In preliminary laboratory science studies, the investigators show that proton pump inhibitors (PPIs) effectively inhibit human fatty acid synthase (FASN) and breast cancer cell survival. A preliminary retrospective study shows that PPI usage in breast cancer patients during chemotherapy significantly improved overall survival. The impact was most striking in patients with triple negative breast cancer (TNBC). Thus, PPIs may be repositioned as safe and effective breast cancer drugs to enhance the effect of chemotherapy.

Many of the hurdles that slow progress from target, to lead compound, to investigational agent, to standard therapy are not barriers for the PPIs. The PPIs are FDA-approved, chronically used, and well tolerated so the investigators can move quickly from the laboratory to a proof of concept clinical trial. Incorporating the PPIs into standard care will require more than the investigators propose here, but the investigators have already plotted the additional steps needed to truly impact patient care. If successful, the data gathered in this proposal will lend support to and guide development of a definitive randomized trial.",yes,TNBC
443,NCT04874935,3,Completed,breast cancer,LANSOPRAZOLE,Potassium-transporting ATPase inhibitor,INHIBITOR,ATPase H+/K+ transporting subunit alpha,ATP4A,Small molecule,Investigation of the possible efficacy and safety of lansoprazole co-administration with neoadjuvant chemotherapy in tumor response in women with breast cancer who will be planned for surgery.,yes,NA
